"","id","name","gender","birthdate","birthplace","deathdate","deathplace","category","year","share","overallmotivation","motivation","affiliations","adjustedBirthdate","decadeFloor","decadeCeiling"
"718",941,"Rainer Weiss","male","1932-09-29","Berlin Germany","","","Physics",2017,"1/2","","for decisive contributions to the LIGO detector and the observation of gravitational waves","LIGO/VIRGO Collaboration; N/A; Massachusetts Institute of Technology (MIT); Cambridge MA USA",1932-09-29,2010,2019
"719",511,"Ralph Bunche","male","1904-08-07","Detroit MI USA","1971-12-09","New York NY USA","Peace",1950,"1","","for his work as mediator in Palestine in 1948-1949","Harvard University; Cambridge MA USA",1904-08-07,1950,1959
"720",863,"Ralph M. Steinman","male","1943-01-14","Montreal Canada","2011-09-30","N/A","Physiology or Medicine",2011,"1/2","","for his discovery of the dendritic cell and its role in adaptive immunity","Rockefeller University; New York NY USA",1943-01-14,2010,2019
"721",466,"Randal Cremer","male","1828-03-18","Fareham United Kingdom","1908-07-22","London United Kingdom","Peace",1903,"1","","for his longstanding and devoted effort in favour of the ideas of peace and arbitration","",1828-03-18,1900,1909
"722",885,"Randy W. Schekman","male","1948-12-30","St. Paul MN USA","","","Physiology or Medicine",2013,"1/3","","for their discoveries of machinery regulating vesicle traffic a major transport system in our cells","University of California; Berkeley CA USA; Howard Hughes Medical Institute; N/A",1948-12-30,2010,2019
"723",753,"Raymond Davis Jr.","male","1914-10-14","Washington DC USA","2006-05-31","Blue Point NY USA","Physics",2002,"1/4","","for pioneering contributions to astrophysics in particular for the detection of cosmic neutrinos","University of Pennsylvania; Philadelphia PA USA",1914-10-14,2000,2009
"724",989,"Reinhard Genzel","male","1952-03-24","Bad Homburg vor der Höhe Germany","","","Physics",2020,"1/4","","for the discovery of a supermassive compact object at the centre of our galaxy","Max Planck Institute for Extraterrestrial Physics; Garching Germany; University of California; Berkeley CA USA",1952-03-24,2020,2029
"725",713,"Reinhard Selten","male","1930-10-05","Breslau Germany (now Wroclaw Poland)","2016-08-23","Poznan Poland","Economic Sciences",1994,"1/3","","for their pioneering analysis of equilibria in the theory of non-cooperative games","Rheinische Friedrich-Wilhelms-Universität; Bonn Germany",1930-10-05,1990,1999
"726",407,"Renato Dulbecco","male","1914-02-22","Catanzaro Italy","2012-02-19","La Jolla CA USA","Physiology or Medicine",1975,"1/3","","for their discoveries concerning the interaction between tumour viruses and the genetic material of the cell","Imperial Cancer Research Fund Laboratory; London United Kingdom",1914-02-22,1970,1979
"727",526,"René Cassin","male","1887-10-05","Bayonne France","1976-02-20","Paris France","Peace",1968,"1","","for his struggle to ensure the rights of man as stipulated in the UN Declaration","",1887-10-05,1960,1969
"728",755,"Riccardo Giacconi","male","1931-10-06","Genoa Italy","2018-12-16","La Jolla CA USA","Physics",2002,"1/2","","for pioneering contributions to astrophysics which have led to the discovery of cosmic X-ray sources","Associated Universities Inc.; Washington DC USA",1931-10-06,2000,2009
"729",774,"Richard Axel","male","1946-07-02","New York NY USA","","","Physiology or Medicine",2004,"1/2","","for their discoveries of odorant receptors and the organization of the olfactory system","Columbia University; New York NY USA",1946-07-02,2000,2009
"730",286,"Richard E. Smalley","male","1943-06-06","Akron OH USA","2005-10-28","Houston TX USA","Chemistry",1996,"1/3","","for their discovery of fullerenes","Rice University; Houston TX USA",1943-06-06,1990,1999
"731",140,"Richard E. Taylor","male","1929-11-02","Medicine Hat Alberta Canada","2018-02-22","Stanford CA USA","Physics",1990,"1/3","","for their pioneering investigations concerning deep inelastic scattering of electrons on protons and bound neutrons which have been of essential importance for the development of the quark model in particle physics","Stanford University; Stanford CA USA",1929-11-02,1990,1999
"732",851,"Richard F. Heck","male","1931-08-15","Springfield MA USA","2015-10-09","Manila Philippines","Chemistry",2010,"1/3","","for palladium-catalyzed cross couplings in organic synthesis","University of Delaware; USA",1931-08-15,2010,2019
"733",949,"Richard H. Thaler","male","1945-09-12","East Orange NJ USA","","","Economic Sciences",2017,"1","","for his contributions to behavioural economics","University of Chicago; Chicago IL USA",1945-09-12,2010,2019
"734",946,"Richard Henderson","male","1945-07-19","Edinburgh Scotland","","","Chemistry",2017,"1/3","","for developing cryo-electron microscopy for the high-resolution structure determination of biomolecules in solution","MRC Laboratory of Molecular Biology; Cambridge United Kingdom",1945-07-19,2010,2019
"735",448,"Richard J. Roberts","male","1943-09-06","Derby United Kingdom","","","Physiology or Medicine",1993,"1/2","","for their discoveries of split genes","New England Biolabs; Beverly MA USA",1943-09-06,1990,1999
"736",198,"Richard Kuhn","male","1900-12-03","Vienna Austria-Hungary (now Austria)","1967-07-31","Heidelberg West Germany (now Germany)","Chemistry",1938,"1","","for his work on carotenoids and vitamins","Kaiser-Wilhelm-Institut (now Max-Planck Institut) für Medizinische Forschung; Heidelberg Germany; University of Heidelberg; Heidelberg Germany",1900-12-03,1930,1939
"737",215,"Richard L.M. Synge","male","1914-10-28","Liverpool United Kingdom","1994-08-18","Norwich United Kingdom","Chemistry",1952,"1/2","","for their invention of partition chromatography","Rowett Research Institute; Bucksburn (Scotland) United Kingdom",1914-10-28,1950,1959
"738",86,"Richard P. Feynman","male","1918-05-11","New York NY USA","1988-02-15","Los Angeles CA USA","Physics",1965,"1/3","","for their fundamental work in quantum electrodynamics with deep-ploughing consequences for the physics of elementary particles","California Institute of Technology (Caltech); Pasadena CA USA",1918-05-11,1960,1969
"739",276,"Richard R. Ernst","male","1933-08-14","Winterthur Switzerland","","","Chemistry",1991,"1","","for his contributions to the development of the methodology of high resolution nuclear magnetic resonance (NMR) spectroscopy","Eidgenössische Technische Hochschule (Swiss Federal Institute of Technology); Zurich Switzerland",1933-08-14,1990,1999
"740",796,"Richard R. Schrock","male","1945-01-04","Berne IN USA","","","Chemistry",2005,"1/3","","for the development of the metathesis method in organic synthesis","Massachusetts Institute of Technology (MIT); Cambridge MA USA",1945-01-04,2000,2009
"741",698,"Richard Stone","male","1913-08-30","London United Kingdom","1991-12-06","Cambridge United Kingdom","Economic Sciences",1984,"1","","for having made fundamental contributions to the development of systems of national accounts and hence greatly improved the basis for empirical economic analysis","University of Cambridge; Cambridge United Kingdom",1913-08-30,1980,1989
"742",176,"Richard Willstätter","male","1872-08-13","Karlsruhe Germany","1942-08-03","Locarno Switzerland","Chemistry",1915,"1","","for his researches on plant pigments especially chlorophyll","Munich University; Munich Germany",1872-08-13,1910,1919
"743",182,"Richard Zsigmondy","male","1865-04-01","Vienna Austrian Empire (now Austria)","1929-09-24","Göttingen Germany","Chemistry",1925,"1","","for his demonstration of the heterogenous nature of colloid solutions and for the methods he used which have since become fundamental in modern colloid chemistry","Goettingen University; Göttingen Germany",1865-04-01,1920,1929
"744",554,"Rigoberta Menchú Tum","female","1959-01-09","Aldea Chimel Guatemala","","","Peace",1992,"1","","for her struggle for social justice and ethno-cultural reconciliation based on respect for the rights of indigenous peoples","",1959-01-09,1990,1999
"745",435,"Rita Levi-Montalcini","female","1909-04-22","Turin Italy","2012-12-30","Rome Italy","Physiology or Medicine",1986,"1/2","","for their discoveries of growth factors","Institute of Cell Biology of the C.N.R.; Rome Italy",1909-04-22,1980,1989
"746",258,"Roald Hoffmann","male","1937-07-18","Zloczov Poland (now Ukraine)","","","Chemistry",1981,"1/2","","for their theories developed independently concerning the course of chemical reactions","Cornell University; Ithaca NY USA",1937-07-18,1980,1989
"747",28,"Robert A. Millikan","male","1868-03-22","Morrison IL USA","1953-12-19","San Marino CA USA","Physics",1923,"1","","for his work on the elementary charge of electricity and on the photoelectric effect","California Institute of Technology (Caltech); Pasadena CA USA",1868-03-22,1920,1929
"748",155,"Robert B. Laughlin","male","1950-11-01","Visalia CA USA","","","Physics",1998,"1/3","","for their discovery of a new form of quantum fluid with fractionally charged excitations","Stanford University; Stanford CA USA",1950-11-01,1990,1999
"749",996,"Robert B. Wilson","male","1937-05-16","Geneva NE USA","","","Economic Sciences",2020,"1/2","","for improvements to auction theory and inventions of new auction formats","Stanford University; Stanford CA USA",1937-05-16,2020,2029
"750",231,"Robert B. Woodward","male","1917-04-10","Boston MA USA","1979-07-08","Cambridge MA USA","Chemistry",1965,"1","","for his outstanding achievements in the art of organic synthesis","Harvard University; Cambridge MA USA",1917-04-10,1960,1969
"751",308,"Robert Bárány","male","1876-04-22","Vienna Austria","1936-04-08","Uppsala Sweden","Physiology or Medicine",1914,"1","","for his work on the physiology and pathology of the vestibular apparatus","Vienna University; Vienna Austria",1876-04-22,1910,1919
"752",717,"Robert C. Merton","male","1944-07-31","New York NY USA","","","Economic Sciences",1997,"1/2","","for a new method to determine the value of derivatives","Harvard University; Cambridge MA USA",1944-07-31,1990,1999
"753",151,"Robert C. Richardson","male","1937-06-26","Washington DC USA","2013-02-19","Ithaca NY USA","Physics",1996,"1/3","","for their discovery of superfluidity in helium-3","Cornell University; Ithaca NY USA",1937-06-26,1990,1999
"754",502,"Robert Cecil Viscount Cecil of Chelwood","male","1864-09-14","London United Kingdom","1958-11-24","Tunbridge Wells United Kingdom","Peace",1937,"1","","for his tireless effort in support of the League of Nations disarmament and peace","",1864-09-14,1930,1939
"755",714,"Robert E. Lucas Jr.","male","1937-09-15","Yakima WA USA","","","Economic Sciences",1995,"1","","for having developed and applied the hypothesis of rational expectations and thereby having transformed macroeconomic analysis and deepened our understanding of economic policy","University of Chicago; Chicago IL USA",1937-09-15,1990,1999
"756",284,"Robert F. Curl Jr.","male","1933-08-23","Alice TX USA","","","Chemistry",1996,"1/3","","for their discovery of fullerenes","Rice University; Houston TX USA",1933-08-23,1990,1999
"757",771,"Robert F. Engle III","male","1942-11-10","Syracuse NY USA","","","Economic Sciences",2003,"1/2","","for methods of analyzing economic time series with time-varying volatility (ARCH)","New York University; New York NY USA",1942-11-10,2000,2009
"758",458,"Robert F. Furchgott","male","1916-06-04","Charleston SC USA","2009-05-19","Seattle WA USA","Physiology or Medicine",1998,"1/3","","for their discoveries concerning nitric oxide as a signalling molecule in the cardiovascular system","SUNY Health Science Center; Brooklyn NY USA",1916-06-04,1990,1999
"759",848,"Robert G. Edwards","male","1925-09-27","Batley United Kingdom","2013-04-10","Cambridge United Kingdom","Physiology or Medicine",2010,"1","","for the development of in vitro fertilization","University of Cambridge; Cambridge United Kingdom",1925-09-27,2010,2019
"760",795,"Robert H. Grubbs","male","1942-02-27","Possum Trot KY USA","","","Chemistry",2005,"1/3","","for the development of the metathesis method in organic synthesis","California Institute of Technology (Caltech); Pasadena CA USA",1942-02-27,2000,2009
"761",75,"Robert Hofstadter","male","1915-02-05","New York NY USA","1990-11-17","Stanford CA USA","Physics",1961,"1/2","","for his pioneering studies of electron scattering in atomic nuclei and for his thereby achieved discoveries concerning the structure of the nucleons","Stanford University; Stanford CA USA",1915-02-05,1960,1969
"762",271,"Robert Huber","male","1937-02-20","Munich Germany","","","Chemistry",1988,"1/3","","for the determination of the three-dimensional structure of a photosynthetic reaction centre","Max-Planck-Institut für Biochemie; Martinsried Germany",1937-02-20,1980,1989
"763",799,"Robert J. Aumann","male","1930-06-08","Frankfurt-on-the-Main Germany","","","Economic Sciences",2005,"1/2","","for having enhanced our understanding of conflict and cooperation through game-theory analysis","University of Jerusalem Center for RationalityHebrew; Jerusalem Israel",1930-06-08,2000,2009
"764",878,"Robert J. Lefkowitz","male","1943-04-15","New York NY USA","","","Chemistry",2012,"1/2","","for studies of G-protein-coupled receptors","Howard Hughes Medical Institute; N/A; Duke University Medical Center; Durham NC USA",1943-04-15,2010,2019
"765",896,"Robert J. Shiller","male","1946-03-29","Detroit MI USA","","","Economic Sciences",2013,"1/3","","for their empirical analysis of asset prices","Yale University; New Haven CT USA",1946-03-29,2010,2019
"766",297,"Robert Koch","male","1843-12-11","Clausthal (now Clausthal-Zellerfeld) Germany","1910-05-27","Baden-Baden Germany","Physiology or Medicine",1905,"1","","for his investigations and discoveries in relation to tuberculosis","Institute for Infectious Diseases; Berlin Germany",1843-12-11,1900,1909
"767",701,"Robert M. Solow","male","1924-08-23","Brooklyn NY USA","","","Economic Sciences",1987,"1","","for his contributions to the theory of economic growth","Massachusetts Institute of Technology (MIT); Cambridge MA USA",1924-08-23,1980,1989
"768",720,"Robert Mundell","male","1932-10-24","Kingston ON Canada","","","Economic Sciences",1999,"1","","for his analysis of monetary and fiscal policy under different exchange rate regimes and his analysis of optimum currency areas","Columbia University; New York NY USA",1932-10-24,1990,1999
"769",232,"Robert S. Mulliken","male","1896-06-07","Newburyport MA USA","1986-10-31","Arlington VA USA","Chemistry",1966,"1","","for his fundamental work concerning chemical bonds and the electronic structure of molecules by the molecular orbital method","University of Chicago; Chicago IL USA",1896-06-07,1960,1969
"770",96,"Robert Schrieffer","male","1931-05-31","Oak Park IL USA","2019-07-27","Tallahassee FL USA","Physics",1972,"1/3","","for their jointly developed theory of superconductivity usually called the BCS-theory","University of Pennsylvania; Philadelphia PA USA",1931-05-31,1970,1979
"771",709,"Robert W. Fogel","male","1927-07-01","New York NY USA","2013-06-11","Oak Lawn IL USA","Economic Sciences",1993,"1/2","","for having renewed research in economic history by applying economic theory and quantitative methods in order to explain economic and institutional change","University of Chicago; Chicago IL USA",1927-07-01,1990,1999
"772",388,"Robert W. Holley","male","1922-01-28","Urbana IL USA","1993-02-11","Los Gatos CA USA","Physiology or Medicine",1968,"1/3","","for their interpretation of the genetic code and its function in protein synthesis","Cornell University; Ithaca NY USA",1922-01-28,1960,1969
"773",112,"Robert Woodrow Wilson","male","1936-01-10","Houston TX USA","","","Physics",1978,"1/4","","for their discovery of cosmic microwave background radiation","Bell Laboratories; Holmdel NJ USA",1936-01-10,1970,1979
"774",770,"Roderick MacKinnon","male","1956-02-19","Burlington MA USA","","","Chemistry",2003,"1/2","for discoveries concerning channels in cell membranes","for structural and mechanistic studies of ion channels","Rockefeller University; New York NY USA; Howard Hughes Medical Institute; N/A",1956-02-19,2000,2009
"775",399,"Rodney R. Porter","male","1917-10-08","Newton-le-Willows United Kingdom","1985-09-06","Winchester United Kingdom","Physiology or Medicine",1972,"1/2","","for their discoveries concerning the chemical structure of antibodies","University of Oxford; Oxford United Kingdom",1917-10-08,1970,1979
"776",822,"Roger B. Myerson","male","1951-03-29","Boston MA USA","","","Economic Sciences",2007,"1/3","","for having laid the foundations of mechanism design theory","University of Chicago; Chicago IL USA",1951-03-29,2000,2009
"777",806,"Roger D. Kornberg","male","1947-04-24","St. Louis MO USA","","","Chemistry",2006,"1","","for his studies of the molecular basis of eukaryotic transcription","Stanford University; Stanford CA USA",1947-04-24,2000,2009
"778",411,"Roger Guillemin","male","1924-01-11","Dijon France","","","Physiology or Medicine",1977,"1/4","","for their discoveries concerning the peptide hormone production of the brain","The Salk Institute; San Diego CA USA",1924-01-11,1970,1979
"779",609,"Roger Martin du Gard","male","1881-03-23","Neuilly-sur-Seine France","1958-08-22","Bellême France","Literature",1937,"1","","for the artistic power and truth with which he has depicted human conflict as well as some fundamental aspects of contemporary life in his novel-cycle <I>Les Thibault</I>","",1881-03-23,1930,1939
"780",988,"Roger Penrose","male","1931-08-08","Colchester United Kingdom","","","Physics",2020,"1/2","","for the discovery that black hole formation is a robust prediction of the general theory of relativity","University of Oxford; Oxford United Kingdom",1931-08-08,2020,2029
"781",422,"Roger W. Sperry","male","1913-08-20","Hartford CT USA","1994-04-17","Pasadena CA USA","Physiology or Medicine",1981,"1/2","","for his discoveries concerning the functional specialization of the cerebral hemispheres","California Institute of Technology (Caltech); Pasadena CA USA",1913-08-20,1980,1989
"782",831,"Roger Y. Tsien","male","1952-02-01","New York NY USA","2016-08-24","Eugene OR USA","Chemistry",2008,"1/3","","for the discovery and development of the green fluorescent protein GFP","University of California; San Diego CA USA; Howard Hughes Medical Institute; N/A",1952-02-01,2000,2009
"783",456,"Rolf M. Zinkernagel","male","1944-01-06","Basel Switzerland","","","Physiology or Medicine",1996,"1/2","","for their discoveries concerning the specificity of the cell mediated immune defence","University of Zurich Institute of Experimental Immunology; Zurich Switzerland",1944-01-06,1990,1999
"784",584,"Romain Rolland","male","1866-01-29","Clamecy France","1944-12-30","Vézelay France","Literature",1915,"1","","as a tribute to the lofty idealism of his literary production and to the sympathy and love of truth with which he has described different types of human beings","",1866-01-29,1910,1919
"785",234,"Ronald G.W. Norrish","male","1897-11-09","Cambridge United Kingdom","1978-06-07","Cambridge United Kingdom","Chemistry",1967,"1/4","","for their studies of extremely fast chemical reactions effected by disturbing the equilibrium by means of very short pulses of energy","Institute of Physical Chemistry; Cambridge United Kingdom",1897-11-09,1960,1969
"786",707,"Ronald H. Coase","male","1910-12-29","Willesden United Kingdom","2013-09-02","Chicago IL USA","Economic Sciences",1991,"1","","for his discovery and clarification of the significance of transaction costs and property rights for the institutional structure and functioning of the economy","University of Chicago; Chicago IL USA",1910-12-29,1990,1999
"787",294,"Ronald Ross","male","1857-05-13","Almora India","1932-09-16","Putney Heath United Kingdom","Physiology or Medicine",1902,"1","","for his work on malaria by which he has shown how it enters the organism and thereby has laid the foundation for successful research on this disease and methods of combating it","University College; Liverpool United Kingdom",1857-05-13,1900,1909
"788",413,"Rosalyn Yalow","female","1921-07-19","New York NY USA","2011-05-30","New York NY USA","Physiology or Medicine",1977,"1/2","","for the development of radioimmunoassays of peptide hormones","Veterans Administration Hospital; Bronx NY USA",1921-07-19,1970,1979
"789",791,"Roy J. Glauber","male","1925-09-01","New York NY USA","2018-12-26","Newton MA USA","Physics",2005,"1/2","","for his contribution to the quantum theory of optical coherence","Harvard University; Cambridge MA USA",1925-09-01,2000,2009
"790",578,"Rudolf Eucken","male","1846-01-05","Aurich East Friesland (now Germany)","1926-09-14","Jena Germany","Literature",1908,"1","","in recognition of his earnest search for truth his penetrating power of thought his wide range of vision and the warmth and strength in presentation with which in his numerous works he has vindicated and developed an idealistic philosophy of life","",1846-01-05,1900,1909
"791",76,"Rudolf Mössbauer","male","1929-01-31","Munich Germany","2011-09-14","N/A","Physics",1961,"1/2","","for his researches concerning the resonance absorption of gamma radiation and his discovery in this connection of the effect which bears his name","Technical University; Munich Germany; California Institute of Technology (Caltech); Pasadena CA USA",1929-01-31,1960,1969
"792",277,"Rudolph A. Marcus","male","1923-07-21","Montreal Canada","","","Chemistry",1992,"1","","for his contributions to the theory of electron transfer reactions in chemical systems","California Institute of Technology (Caltech); Pasadena CA USA",1923-07-21,1990,1999
"793",577,"Rudyard Kipling","male","1865-12-30","Bombay British India (now Mumbai India)","1936-01-18","London United Kingdom","Literature",1907,"1","","in consideration of the power of observation originality of imagination virility of ideas and remarkable talent for narration which characterize the creations of this world-famous author","",1865-12-30,1900,1909
"794",143,"Russell A. Hulse","male","1950-11-28","New York NY USA","","","Physics",1993,"1/2","","for the discovery of a new type of pulsar a discovery that has opened up new possibilities for the study of gravitation","Princeton University; Princeton NJ USA",1950-11-28,1990,1999
"795",742,"Ryoji Noyori","male","1938-09-03","Kobe Japan","","","Chemistry",2001,"1/4","","for their work on chirally catalysed hydrogenation reactions","Nagoya University; Nagoya Japan",1938-09-03,2000,2009
"796",631,"Saint-John Perse","male","1887-05-31","Pointe-à-Pitre Guadeloupe Island","1975-09-20","Presqu'île-de-Giens France","Literature",1960,"1","","for the soaring flight and the evocative imagery of his poetry which in a visionary fashion reflects the conditions of our time","",1887-05-31,1960,1969
"797",393,"Salvador E. Luria","male","1912-08-13","Turin Italy","1991-02-06","Lexington MA USA","Physiology or Medicine",1969,"1/3","","for their discoveries concerning the replication mechanism and the genetic structure of viruses","Massachusetts Institute of Technology (MIT); Cambridge MA USA",1912-08-13,1960,1969
"798",630,"Salvatore Quasimodo","male","1901-08-20","Modica Italy","1968-06-14","Naples Italy","Literature",1959,"1","","for his lyrical poetry which with classical fire expresses the tragic experience of life in our own times","",1901-08-20,1950,1959
"799",643,"Samuel Beckett","male","1906-04-13","Dublin Ireland","1989-12-22","Paris France","Literature",1969,"1","","for his writing which - in new forms for the novel and drama - in the destitution of modern man acquires its elevation","",1906-04-13,1960,1969
"800",106,"Samuel C.C. Ting","male","1936-01-27","Ann Arbor MI USA","","","Physics",1976,"1/2","","for their pioneering work in the discovery of a heavy elementary particle of a new kind","Massachusetts Institute of Technology (MIT); Cambridge MA USA",1936-01-27,1970,1979
"801",299,"Santiago Ramón y Cajal","male","1852-05-01","Petilla de Aragón Spain","1934-10-17","Madrid Spain","Physiology or Medicine",1906,"1/2","","in recognition of their work on the structure of the nervous system","Madrid University; Madrid Spain",1852-05-01,1900,1909
"802",917,"Satoshi &#332;mura","male","1935-07-12","Yamanashi Prefecture Japan","","","Physiology or Medicine",2015,"1/4","","for their discoveries concerning a novel therapy against infections caused by roundworm parasites","Kitasato University; Tokyo Japan",1935-07-12,2010,2019
"803",652,"Saul Bellow","male","1915-06-10","Montreal Canada","2005-04-05","Brookline MA USA","Literature",1976,"1","","for the human understanding and subtle analysis of contemporary culture that are combined in his work","",1915-06-10,1970,1979
"804",864,"Saul Perlmutter","male","1959-00-00","Champaign-Urbana IL USA","","","Physics",2011,"1/2","","for the discovery of the accelerating expansion of the Universe through observations of distant supernovae","Lawrence Berkeley National Laboratory; Berkeley CA USA; University of California; Berkeley CA USA",1959-01-01,2010,2019
"805",672,"Seamus Heaney","male","1939-04-13","Casteldàwson Northern Ireland","2013-08-30","Dublin Ireland","Literature",1995,"1","","for works of lyrical beauty and ethical depth which exalt everyday miracles and the living past","",1939-04-13,1990,1999
"806",532,"Seán MacBride","male","1904-01-26","Paris France","1988-01-15","Dublin Ireland","Peace",1974,"1/2","","for his efforts to secure and develop human rights throughout the world","",1904-01-26,1970,1979
"807",579,"Selma Lagerlöf","female","1858-11-20","Mårbacka Sweden","1940-03-16","Mårbacka Sweden","Literature",1909,"1","","in appreciation of the lofty idealism vivid imagination and spiritual perception that characterize her writings","",1858-11-20,1900,1909
