"","id","name","gender","birthdate","birthplace","deathdate","deathplace","category","year","share","overallmotivation","motivation","affiliations","adjustedBirthdate","decadeFloor","decadeCeiling"
"449",637,"Jean-Paul Sartre","male","1905-06-21","Paris France","1980-04-15","Paris France","Literature",1964,"1","","for his work which rich in ideas and filled with the spirit of freedom and the quest for truth has exerted a far-reaching influence on our age","",1905-06-21,1960,1969
"450",931,"Jean-Pierre Sauvage","male","1944-10-21","Paris France","","","Chemistry",2016,"1/3","","for the design and synthesis of molecular machines","University of Strasbourg; Strasbourg France",1944-10-21,2010,2019
"451",938,"Jeffrey C. Hall","male","1945-05-03","New York NY USA","","","Physiology or Medicine",2017,"1/3","","for their discoveries of molecular mechanisms controlling the circadian rhythm","University of Maine; Maine ME USA",1945-05-03,2010,2019
"452",992,"Jennifer A. Doudna","female","1964-02-19","Washington DC USA","","","Chemistry",2020,"1/2","","for the development of a method for genome editing","University of California; Berkeley CA USA",1964-02-19,2020,2029
"453",289,"Jens C. Skou","male","1918-10-08","Lemvig Denmark","2018-05-28","Aarhus Denmark","Chemistry",1997,"1/2","","for the first discovery of an ion-transporting enzyme Na+ K+ -ATPase","Aarhus University; Aarhus Denmark",1918-10-08,1990,1999
"454",138,"Jerome I. Friedman","male","1930-03-28","Chicago IL USA","","","Physics",1990,"1/3","","for their pioneering investigations concerning deep inelastic scattering of electrons on protons and bound neutrons which have been of essential importance for the development of the quark model in particle physics","Massachusetts Institute of Technology (MIT); Cambridge MA USA",1930-03-28,1990,1999
"455",263,"Jerome Karle","male","1918-06-18","New York NY USA","2013-06-06","N/A","Chemistry",1985,"1/2","","for their outstanding achievements in the development of direct methods for the determination of crystal structures","US Naval Research Laboratory; Washington DC USA",1918-06-18,1980,1989
"456",762,"Jimmy Carter","male","1924-10-01","Plains GA USA","","","Peace",2002,"1","","for his decades of untiring effort to find peaceful solutions to international conflicts to advance democracy and human rights and to promote economic and social development","",1924-10-01,2000,2009
"457",945,"Joachim Frank","male","1940-09-12","Siegen Germany","","","Chemistry",2017,"1/3","","for developing cryo-electron microscopy for the high-resolution structure determination of biomolecules in solution","Columbia University; New York NY USA",1940-09-12,2010,2019
"458",565,"Jody Williams","female","1950-10-09","Putney VT USA","","","Peace",1997,"1/2","","for their work for the banning and clearing of anti-personnel mines","",1950-10-09,1990,1999
"459",270,"Johann Deisenhofer","male","1943-09-30","Zusamaltheim Germany","","","Chemistry",1988,"1/3","","for the determination of the three-dimensional structure of a photosynthetic reaction centre","University of Texas Southwestern Medical Center at Dallas; Dallas TX USA; Howard Hughes Medical Institute; N/A",1943-09-30,1980,1989
"460",15,"Johannes Diderik van der Waals","male","1837-11-23","Leiden the Netherlands","1923-03-08","Amsterdam the Netherlands","Physics",1910,"1","","for his work on the equation of state for gases and liquids","Amsterdam University; Amsterdam the Netherlands",1837-11-23,1910,1919
"461",316,"Johannes Fibiger","male","1867-04-23","Silkeborg Denmark","1928-01-30","Copenhagen Denmark","Physiology or Medicine",1926,"1","","for his discovery of the Spiroptera carcinoma","Copenhagen University; Copenhagen Denmark",1867-04-23,1920,1929
"462",24,"Johannes Stark","male","1874-04-15","Schickenhof Germany","1957-06-21","Traunstein West Germany (now Germany)","Physics",1919,"1","","for his discovery of the Doppler effect in canal rays and the splitting of spectral lines in electric fields","Greifswald University; Greifswald Germany",1874-04-15,1910,1919
"463",614,"Johannes V. Jensen","male","1873-01-20","Farsø Denmark","1950-11-25","Copenhagen Denmark","Literature",1944,"1","","for the rare strength and fertility of his poetic imagination with which is combined an intellectual curiosity of wide scope and a bold freshly creative style","",1873-01-20,1940,1949
"464",756,"John B. Fenn","male","1917-06-15","New York NY USA","2010-12-10","Richmond VA USA","Chemistry",2002,"1/4","for the development of methods for identification and structure analyses of biological macromolecules","for their development of soft desorption ionisation methods for mass spectrometric analyses of biological macromolecules","Virginia Commonwealth University; Richmond VA USA",1917-06-15,2000,2009
"465",976,"John B. Goodenough","male","1922-07-25","Jena Germany","","","Chemistry",2019,"1/3","","for the development of lithium-ion batteries","University of Texas; Austin TX USA",1922-07-25,2010,2019
"466",66,"John Bardeen","male","1908-05-23","Madison WI USA","1991-01-30","Boston MA USA","Physics",1956,"1/3","","for their researches on semiconductors and their discovery of the transistor effect","University of Illinois; Urbana IL USA",1908-05-23,1950,1959
"467",66,"John Bardeen","male","1908-05-23","Madison WI USA","1991-01-30","Boston MA USA","Physics",1972,"1/3","","for their jointly developed theory of superconductivity usually called the BCS-theory","University of Illinois; Urbana IL USA",1908-05-23,1970,1979
"468",711,"John C. Harsanyi","male","1920-05-29","Budapest Hungary","2000-08-09","Berkeley CA USA","Economic Sciences",1994,"1/3","","for their pioneering analysis of equilibria in the theory of non-cooperative games","University of California; Berkeley CA USA",1920-05-29,1990,1999
"469",227,"John C. Kendrew","male","1917-03-24","Oxford United Kingdom","1997-08-23","Cambridge United Kingdom","Chemistry",1962,"1/2","","for their studies of the structures of globular proteins","MRC Laboratory of Molecular Biology; Cambridge United Kingdom",1917-03-24,1960,1969
"470",804,"John C. Mather","male","1946-08-07","Roanoke VA USA","","","Physics",2006,"1/2","","for their discovery of the blackbody form and anisotropy of the cosmic microwave background radiation","NASA Goddard Space Flight Center; Greenbelt MD USA",1946-08-07,2000,2009
"471",266,"John C. Polanyi","male","1929-01-23","Berlin Germany","","","Chemistry",1986,"1/3","","for their contributions concerning the dynamics of chemical elementary processes","University of Toronto; Toronto Canada",1929-01-23,1980,1989
"472",56,"John Cockcroft","male","1897-05-27","Todmorden United Kingdom","1967-09-18","Cambridge United Kingdom","Physics",1951,"1/2","","for their pioneer work on the transmutation of atomic nuclei by artificially accelerated atomic particles","Atomic Energy Research Establishment; Harwell Berkshire United Kingdom",1897-05-27,1950,1959
"473",247,"John Cornforth","male","1917-09-07","Sydney Australia","2013-12-08","N/A","Chemistry",1975,"1/2","","for his work on the stereochemistry of enzyme-catalyzed reactions","University of Sussex; Brighton United Kingdom",1917-09-07,1970,1979
"474",752,"John E. Sulston","male","1942-03-27","Cambridge United Kingdom","2018-03-06","N/A","Physiology or Medicine",2002,"1/3","","for their discoveries concerning genetic regulation of organ development and programmed cell death'","The Wellcome Trust Sanger Institute; Cambridge United Kingdom",1942-03-27,2000,2009
"475",288,"John E. Walker","male","1941-01-07","Halifax United Kingdom","","","Chemistry",1997,"1/4","","for their elucidation of the enzymatic mechanism underlying the synthesis of adenosine triphosphate (ATP)","MRC Laboratory of Molecular Biology; Cambridge United Kingdom",1941-01-07,1990,1999
"476",356,"John F. Enders","male","1897-02-10","West Hartford CT USA","1985-09-08","Waterford CT USA","Physiology or Medicine",1954,"1/3","","for their discovery of the ability of poliomyelitis viruses to grow in cultures of various types of tissue","Harvard Medical School; Boston MA USA; Research Division of Infectious Diseases Children's Medical Center; Boston MA USA",1897-02-10,1950,1959
"477",712,"John F. Nash Jr.","male","1928-06-13","Bluefield WV USA","2015-05-23","New Jersey NJ USA","Economic Sciences",1994,"1/3","","for their pioneering analysis of equilibria in the theory of non-cooperative games","Princeton University; Princeton NJ USA",1928-06-13,1990,1999
"478",605,"John Galsworthy","male","1867-08-14","Kingston Hill United Kingdom","1933-01-31","London United Kingdom","Literature",1932,"1","","for his distinguished art of narration which takes its highest form in <I>The Forsyte Saga</I>","",1867-08-14,1930,1939
"479",205,"John H. Northrop","male","1891-07-05","Yonkers NY USA","1987-05-27","Wickenberg AZ USA","Chemistry",1946,"1/4","","for their preparation of enzymes and virus proteins in a pure form","Rockefeller Institute for Medical Research; Princeton NJ USA",1891-07-05,1940,1949
"480",109,"John H. van Vleck","male","1899-03-13","Middletown CT USA","1980-10-27","Cambridge MA USA","Physics",1977,"1/3","","for their fundamental theoretical investigations of the electronic structure of magnetic and disordered systems","Harvard University; Cambridge MA USA",1899-03-13,1970,1979
"481",566,"John Hume","male","1937-01-18","Londonderry Northern Ireland","2020-08-03","Londonderry Northern Ireland","Peace",1998,"1/2","","for their efforts to find a peaceful solution to the conflict in Northern Ireland","",1937-01-18,1990,1999
"482",792,"John L. Hall","male","1934-08-21","Denver CO USA","","","Physics",2005,"1/4","","for their contributions to the development of laser-based precision spectroscopy including the optical frequency comb technique","University of Colorado JILA; Boulder CO USA; National Institute of Standards and Technology; Boulder CO USA",1934-08-21,2000,2009
"483",314,"John Macleod","male","1876-09-06","Cluny Scotland","1935-03-16","Aberdeen Scotland","Physiology or Medicine",1923,"1/2","","for the discovery of insulin","University of Toronto; Toronto Canada",1876-09-06,1920,1929
"484",903,"John O'Keefe","male","1939-11-18","New York NY USA","","","Physiology or Medicine",2014,"1/2","","for their discoveries of cells that constitute a positioning system in the brain","University College; London United Kingdom",1939-11-18,2010,2019
"485",291,"John Pople","male","1925-10-31","Burnham-on-Sea United Kingdom","2004-03-15","Chicago IL USA","Chemistry",1998,"1/2","","for his development of computational methods in quantum chemistry","Northwestern University; Evanston IL USA",1925-10-31,1990,1999
"486",681,"John R. Hicks","male","1904-04-08","Warwick United Kingdom","1989-05-20","Blockley United Kingdom","Economic Sciences",1972,"1/2","","for their pioneering contributions to general economic equilibrium theory and welfare theory","All Souls College; Oxford United Kingdom",1904-04-08,1970,1979
"487",507,"John R. Mott","male","1865-05-25","Livingston Manor NY USA","1955-01-31","USA","Peace",1946,"1/2","","for his contribution to the creation of a peace-promoting religious brotherhood across national boundaries","",1865-05-25,1940,1949
"488",427,"John R. Vane","male","1927-03-29","Tardebigg United Kingdom","2004-11-19","Farnborough United Kingdom","Physiology or Medicine",1982,"1/3","","for their discoveries concerning prostaglandins and related biologically active substances","The Wellcome Research Laboratories; Beckenham United Kingdom",1927-03-29,1980,1989
"489",634,"John Steinbeck","male","1902-02-27","Salinas CA USA","1968-12-20","New York NY USA","Literature",1962,"1","","for his realistic and imaginative writings combining as they do sympathetic humour and keen social perception","",1902-02-27,1960,1969
"490",574,"José Echegaray","male","1832-04-19","Madrid Spain","1916-09-04","Madrid Spain","Literature",1904,"1/2","","in recognition of the numerous and brilliant compositions which in an individual and original manner have revived the great traditions of the Spanish drama","",1832-04-19,1900,1909
"491",563,"José Ramos-Horta","male","1949-12-26","Dili East Timor","","","Peace",1996,"1/2","","for their work towards a just and peaceful solution to the conflict in East Timor","",1949-12-26,1990,1999
"492",675,"José Saramago","male","1922-11-16","Azinhaga Portugal","2010-06-18","Lanzarote Spain","Literature",1998,"1","","who with parables sustained by imagination compassion and irony continually enables us once again to apprehend an elusory reality","",1922-11-16,1990,1999
"493",664,"Joseph Brodsky","male","1940-05-24","Leningrad USSR (now St. Petersburg Russia)","1996-01-28","New York NY USA","Literature",1987,"1","","for an all-embracing authorship imbued with clarity of thought and poetic intensity","",1940-05-24,1980,1989
"494",442,"Joseph E. Murray","male","1919-04-01","Milford MA USA","2012-11-26","Boston MA USA","Physiology or Medicine",1990,"1/2","","for their discoveries concerning organ and cell transplantation in the treatment of human disease","Brigham and Women's Hospital; Boston MA USA",1919-04-01,1990,1999
"495",746,"Joseph E. Stiglitz","male","1943-02-09","Gary IN USA","","","Economic Sciences",2001,"1/3","","for their analyses of markets with asymmetric information","Columbia University; New York NY USA",1943-02-09,2000,2009
"496",337,"Joseph Erlanger","male","1874-01-05","San Francisco CA USA","1965-12-05","St. Louis MO USA","Physiology or Medicine",1944,"1/2","","for their discoveries relating to the highly differentiated functions of single nerve fibres","Washington University; St. Louis MO USA",1874-01-05,1940,1949
"497",144,"Joseph H. Taylor Jr.","male","1941-03-29","Philadelphia PA USA","","","Physics",1993,"1/2","","for the discovery of a new type of pulsar a discovery that has opened up new possibilities for the study of gravitation","Princeton University; Princeton NJ USA",1941-03-29,1990,1999
"498",433,"Joseph L. Goldstein","male","1940-04-18","Sumter SC USA","","","Physiology or Medicine",1985,"1/2","","for their discoveries concerning the regulation of cholesterol metabolism","University of Texas Southwestern Medical Center at Dallas; Dallas TX USA",1940-04-18,1980,1989
"499",560,"Joseph Rotblat","male","1908-11-04","Warsaw Russian Empire (now Poland)","2005-08-31","London United Kingdom","Peace",1995,"1/2","","for their efforts to diminish the part played by nuclear arms in international politics and in the longer run to eliminate such arms","",1908-11-04,1990,1999
"500",366,"Joshua Lederberg","male","1925-05-23","Montclair NJ USA","2008-02-02","New York NY USA","Physiology or Medicine",1958,"1/2","","for his discoveries concerning genetic recombination and the organization of the genetic material of bacteria","University of Wisconsin; Madison WI USA",1925-05-23,1950,1959
"501",934,"Juan Manuel Santos","male","1951-08-10","Bogotá Colombia","","","Peace",2016,"1","","for his resolute efforts to bring the country's more than 50-year-long civil war to an end","",1951-08-10,2010,2019
"502",627,"Juan Ramón Jiménez","male","1881-12-24","Moguer Spain","1958-05-29","San Juan Puerto Rico","Literature",1956,"1","","for his lyrical poetry which in Spanish language constitutes an example of high spirit and artistical purity","",1881-12-24,1950,1959
"503",862,"Jules A. Hoffmann","male","1941-08-02","Echternach Luxembourg","","","Physiology or Medicine",2011,"1/4","","for their discoveries concerning the activation of innate immunity","University of Strasbourg; Strasbourg France",1941-08-02,2010,2019
"504",309,"Jules Bordet","male","1870-06-13","Soignies Belgium","1961-04-06","Brussels Belgium","Physiology or Medicine",1919,"1","","for his discoveries relating to immunity","Brussels University; Brussels Belgium",1870-06-13,1910,1919
"505",85,"Julian Schwinger","male","1918-02-12","New York NY USA","1994-07-16","Los Angeles CA USA","Physics",1965,"1/3","","for their fundamental work in quantum electrodynamics with deep-ploughing consequences for the physics of elementary particles","Harvard University; Cambridge MA USA",1918-02-12,1960,1969
"506",396,"Julius Axelrod","male","1912-05-30","New York NY USA","2004-12-29","Rockville MD USA","Physiology or Medicine",1970,"1/3","","for their discoveries concerning the humoral transmitters in the nerve terminals and the mechanism for their storage release and inactivation","National Institutes of Health; Bethesda MD USA",1912-05-30,1970,1979
"507",317,"Julius Wagner-Jauregg","male","1857-03-07","Wels Austria","1940-09-27","Vienna Austria","Physiology or Medicine",1927,"1","","for his discovery of the therapeutic value of malaria inoculation in the treatment of dementia paralytica","Vienna University; Vienna Austria",1857-03-07,1920,1929
"508",131,"K. Alex Müller","male","1927-04-20","Basel Switzerland","","","Physics",1987,"1/2","","for their important break-through in the discovery of superconductivity in ceramic materials","IBM Zurich Research Laboratory; Rüschlikon Switzerland",1927-04-20,1980,1989
"509",120,"Kai M. Siegbahn","male","1918-04-20","Lund Sweden","2007-07-20","Ängelholm Sweden","Physics",1981,"1/2","","for his contribution to the development of high-resolution electron spectroscopy","Uppsala University; Uppsala Sweden",1918-04-20,1980,1989
"510",913,"Kailash Satyarthi","male","1954-01-11","Vidisha India","","","Peace",2014,"1/2","","for their struggle against the suppression of children and young people and for the right of all children to education","",1954-01-11,2010,2019
"511",586,"Karl Gjellerup","male","1857-06-02","Roholte Denmark","1919-10-11","Klotzsche Germany","Literature",1917,"1/2","","for his varied and rich poetry which is inspired by lofty ideals","",1857-06-02,1910,1919
"512",321,"Karl Landsteiner","male","1868-06-14","Vienna Austrian Empire (now Austria)","1943-06-26","New York NY USA","Physiology or Medicine",1930,"1","","for his discovery of human blood groups","Rockefeller Institute for Medical Research; New York NY USA",1868-06-14,1930,1939
"513",400,"Karl von Frisch","male","1886-11-20","Vienna Austria","1982-06-12","Munich West Germany (now Germany)","Physiology or Medicine",1973,"1/3","","for their discoveries concerning organization and elicitation of individual and social behaviour patterns","Zoologisches Institut der Universität München; Munich Germany",1886-11-20,1970,1979
"514",228,"Karl Ziegler","male","1898-11-26","Helsa Germany","1973-08-12","Mülheim West Germany (now Germany)","Chemistry",1963,"1/2","","for their discoveries in the field of the chemistry and technology of high polymers","Max-Planck-Institut für Kohlenforschung (Max-Planck-Institute for Carbon Research); Mülheim/Ruhr Germany",1898-11-26,1960,1969
"515",278,"Kary B. Mullis","male","1944-12-28","Lenoir NC USA","2019-08-07","Newport Beach CA USA","Chemistry",1993,"1/2","for contributions to the developments of methods within DNA-based chemistry","for his invention of the polymerase chain reaction (PCR) method","",1944-12-28,1990,1999
"516",947,"Kazuo Ishiguro","male","1954-11-08","Nagasaki Japan","","","Literature",2017,"1","","who in novels of great emotional force has uncovered the abyss beneath our illusory sense of connection with the world","",1954-11-08,2010,2019
"517",386,"Keffer Hartline","male","1903-12-22","Bloomsburg PA USA","1983-03-17","Fallston MD USA","Physiology or Medicine",1967,"1/3","","for their discoveries concerning the primary physiological and chemical visual processes in the eye","Rockefeller University; New York NY USA",1903-12-22,1960,1969
"518",257,"Kenichi Fukui","male","1918-10-04","Nara Japan","1998-01-09","Kyoto Japan","Chemistry",1981,"1/2","","for their theories developed independently concerning the course of chemical reactions","Kyoto University; Kyoto Japan",1918-10-04,1980,1989
"519",121,"Kenneth G. Wilson","male","1936-06-08","Waltham MA USA","2013-06-15","Saco ME USA","Physics",1982,"1","","for his theory for critical phenomena in connection with phase transitions","Cornell University; Ithaca NY USA",1936-06-08,1980,1989
"520",682,"Kenneth J. Arrow","male","1921-08-23","New York NY USA","2017-02-21","Palo Alto CA USA","Economic Sciences",1972,"1/2","","for their pioneering contributions to general economic equilibrium theory and welfare theory","Harvard University; Cambridge MA USA",1921-08-23,1970,1979
"521",671,"Kenzaburo Oe","male","1935-01-31","Uchiko Japan","","","Literature",1994,"1","","who with poetic force creates an imagined world where life and myth condense to form a disconcerting picture of the human predicament today","",1935-01-31,1990,1999
"522",725,"Kim Dae-jung","male","1925-12-03","Mokpo Korea (now South Korea)","2009-08-18","N/A","Peace",2000,"1","","for his work for democracy and human rights in South Korea and in East Asia in general and for peace and reconciliation with North Korea in particular","",1925-12-03,2000,2009
"523",943,"Kip S. Thorne","male","1940-06-01","Logan UT USA","","","Physics",2017,"1/4","","for decisive contributions to the LIGO detector and the observation of gravitational waves","LIGO/VIRGO Collaboration; N/A; California Institute of Technology (Caltech); Pasadena CA USA",1940-06-01,2010,2019
"524",473,"Klas Pontus Arnoldson","male","1844-10-27","Gothenburg Sweden","1916-02-20","Stockholm Sweden","Peace",1908,"1/2","","for their long time work for the cause of peace as politicians peace society leaders orators and authors","",1844-10-27,1900,1909
"525",126,"Klaus von Klitzing","male","1943-06-28","Schroda German-occupied Poland (now Poland)","","","Physics",1985,"1","","for the discovery of the quantized Hall effect","Max-Planck-Institut für Festkörperforschung; Stuttgart Germany",1943-06-28,1980,1989
"526",589,"Knut Hamsun","male","1859-08-04","Lom Norway","1952-02-19","Grimstad Norway","Literature",1920,"1","","for his monumental work <I>Growth of the Soil</I>","",1859-08-04,1920,1929
"527",749,"Kofi Annan","male","1938-04-08","Kumasi Gold Coast (now Ghana)","2018-08-18","Bern Switzerland","Peace",2001,"1/2","","for their work for a better organized and more peaceful world","",1938-04-08,2000,2009
"528",757,"Koichi Tanaka","male","1959-08-03","Toyama City Japan","","","Chemistry",2002,"1/4","for the development of methods for identification and structure analyses of biological macromolecules","for their development of soft desorption ionisation methods for mass spectrometric analyses of biological macromolecules","Shimadzu Corp.; Kyoto Japan",1959-08-03,2000,2009
"529",378,"Konrad Bloch","male","1912-01-21","Neisse Germany (now Nysa Poland)","2000-10-15","Burlington MA USA","Physiology or Medicine",1964,"1/2","","for their discoveries concerning the mechanism and regulation of the cholesterol and fatty acid metabolism","Harvard University; Cambridge MA USA",1912-01-21,1960,1969
"530",401,"Konrad Lorenz","male","1903-11-07","Vienna Austria","1989-02-27","Vienna Austria","Physiology or Medicine",1973,"1/3","","for their discoveries concerning organization and elicitation of individual and social behaviour patterns","Konrad-Lorenz-Institut der Österreichischen Akademie der Wissen­schaften Forschungsstelle für Ethologie; Altenberg; Grünau im Almtal Austria",1903-11-07,1970,1979
"531",850,"Konstantin Novoselov","male","1974-08-23","Nizhny Tagil Russia","","","Physics",2010,"1/2","","for groundbreaking experiments regarding the two-dimensional material graphene","University of Manchester; Manchester United Kingdom",1974-08-23,2010,2019
"532",211,"Kurt Alder","male","1902-07-10","Königshütte Prussia (now Chorzów Poland)","1958-06-20","Cologne West Germany (now Germany)","Chemistry",1950,"1/2","","for their discovery and development of the diene synthesis","Cologne University; Cologne Germany",1902-07-10,1950,1959
"533",758,"Kurt Wüthrich","male","1938-10-04","Aarberg Switzerland","","","Chemistry",2002,"1/2","for the development of methods for identification and structure analyses of biological macromolecules","for his development of nuclear magnetic resonance spectroscopy for determining the three-dimensional structure of biological macromolecules in solution","Eidgenössische Technische Hochschule (Swiss Federal Institute of Technology); Zurich Switzerland; The Scripps Research Institute; La Jolla CA USA",1938-10-04,2000,2009
"534",236,"Lars Onsager","male","1903-11-27","Kristiania (now Oslo) Norway","1976-10-05","Coral Gables FL USA","Chemistry",1968,"1","","for the discovery of the reciprocal relations bearing his name which are fundamental for the thermodynamics of irreversible processes","Yale University; New Haven CT USA",1903-11-27,1960,1969
"535",895,"Lars Peter Hansen","male","1952-10-26","Urbana IL USA","","","Economic Sciences",2013,"1/3","","for their empirical analysis of asset prices","University of Chicago; Chicago IL USA",1952-10-26,2010,2019
"536",21,"Lawrence Bragg","male","1890-03-31","Adelaide Australia","1971-07-01","Ipswich United Kingdom","Physics",1915,"1/2","","for their services in the analysis of crystal structure by means of X-rays","Victoria University; Manchester United Kingdom",1890-03-31,1910,1919
"537",694,"Lawrence R. Klein","male","1920-09-14","Omaha NE USA","2013-10-20","Gladwyne PA USA","Economic Sciences",1980,"1","","for the creation of econometric models and the application to the analysis of economic fluctuations and economic policies","University of Pennsylvania; Philadelphia PA USA",1920-09-14,1980,1989
"538",531,"Le Duc Tho","male","1911-10-14","Nam Ha province Vietnam","1990-10-13","Hanoi Vietnam","Peace",1973,"1/2","","for jointly having negotiated a cease fire in Vietnam in 1973","",1911-10-14,1970,1979
"539",523,"League of Red Cross Societies","org","1919-00-00","Paris France","","","Peace",1963,"1/2","","for promoting the principles of the Geneva Convention and cooperation with the UN","",1919-01-01,1960,1969
